cv_valid_train_sample_192853-v1_cv_valid_train_sample_192853;cv_valid_train_sample_192853-v1;cv_valid_train_sample_192853;mozzarella is a creamy cheese that goes well with tomato and basil;mozzarella is a creamy cheese that goes well with tomato and basil;2
cv_valid_train_sample_192854-v1_cv_valid_train_sample_192854;cv_valid_train_sample_192854-v1;cv_valid_train_sample_192854;i'll make such a mess of things without you;i'll make such a mess of things without you;2
cv_valid_train_sample_192855-v1_cv_valid_train_sample_192855;cv_valid_train_sample_192855-v1;cv_valid_train_sample_192855;and what do you do in salem he insisted;and what do you do in salem he insisted;2
cv_valid_train_sample_192856-v1_cv_valid_train_sample_192856;cv_valid_train_sample_192856-v1;cv_valid_train_sample_192856;when i'm eating that's all i think about;when i'm eating that's all i think about;2
cv_valid_train_sample_192857-v1_cv_valid_train_sample_192857;cv_valid_train_sample_192857-v1;cv_valid_train_sample_192857;its lower end was still embedded;its lower end was still embedded;2
cv_valid_train_sample_192858-v1_cv_valid_train_sample_192858;cv_valid_train_sample_192858-v1;cv_valid_train_sample_192858;i said good night;i said good night;2
cv_valid_train_sample_192859-v1_cv_valid_train_sample_192859;cv_valid_train_sample_192859-v1;cv_valid_train_sample_192859;no hope no adventure no old kings or destinies no treasure and no pyramids;no hope no adventure no old kings or destinies no treasure and no pyramids;2
cv_valid_train_sample_192860-v1_cv_valid_train_sample_192860;cv_valid_train_sample_192860-v1;cv_valid_train_sample_192860;with the girl with the raven hair his days would never be the same again;with the girl with the raven hair his days would never be the same again;2
cv_valid_train_sample_192861-v1_cv_valid_train_sample_192861;cv_valid_train_sample_192861-v1;cv_valid_train_sample_192861;upon arrival the train was waiting for all passengers;upon arrival the train was waiting for all passengers;2
cv_valid_train_sample_192862-v1_cv_valid_train_sample_192862;cv_valid_train_sample_192862-v1;cv_valid_train_sample_192862;so they think she left it with you;so they think she left it with you;2
cv_valid_train_sample_192863-v1_cv_valid_train_sample_192863;cv_valid_train_sample_192863-v1;cv_valid_train_sample_192863;a half a heelot;a half a heelot;2
cv_valid_train_sample_192864-v1_cv_valid_train_sample_192864;cv_valid_train_sample_192864-v1;cv_valid_train_sample_192864;but we could sell tea in crystal glasses;but we could sell tea in crystal glasses;2
cv_valid_train_sample_192865-v1_cv_valid_train_sample_192865;cv_valid_train_sample_192865-v1;cv_valid_train_sample_192865;we'll have something to drink and eat these hawks;we'll have something to drink and eat these hawks;2
cv_valid_train_sample_192866-v1_cv_valid_train_sample_192866;cv_valid_train_sample_192866-v1;cv_valid_train_sample_192866;air was either entering or escaping at the rim with a thin sizzling sound;air was either entering or escaping at the rim with a thin sizzling sound;2
cv_valid_train_sample_192867-v1_cv_valid_train_sample_192867;cv_valid_train_sample_192867-v1;cv_valid_train_sample_192867;the owner of the dwelling was not amused;the owner of the dwelling was not amused;2
cv_valid_train_sample_192868-v1_cv_valid_train_sample_192868;cv_valid_train_sample_192868-v1;cv_valid_train_sample_192868;i like crepes with nougat;i like crepes with nougat;2
cv_valid_train_sample_192869-v1_cv_valid_train_sample_192869;cv_valid_train_sample_192869-v1;cv_valid_train_sample_192869;he should have decided to become a shepherd the boy said;he should have decided to become a shepherd the boy said;2
cv_valid_train_sample_192870-v1_cv_valid_train_sample_192870;cv_valid_train_sample_192870-v1;cv_valid_train_sample_192870;keep him in here;keep him in here;2
cv_valid_train_sample_192871-v1_cv_valid_train_sample_192871;cv_valid_train_sample_192871-v1;cv_valid_train_sample_192871;the problem is that they don't even realize that they're walking a new road every day;the problem is that they don't even realize that they're walking a new road every day;2
cv_valid_train_sample_192872-v1_cv_valid_train_sample_192872;cv_valid_train_sample_192872-v1;cv_valid_train_sample_192872;where your treasure is there also will be your heart the alchemist had told him;where your treasure is there also will be your heart the alchemist had told him;2
cv_valid_train_sample_192873-v1_cv_valid_train_sample_192873;cv_valid_train_sample_192873-v1;cv_valid_train_sample_192873;you gave them everything i had the boy said;you gave them everything i had the boy said;2
cv_valid_train_sample_192874-v1_cv_valid_train_sample_192874;cv_valid_train_sample_192874-v1;cv_valid_train_sample_192874;he approached the mass and was surprised at the size and the shape;he approached the mass and was surprised at the size and the shape;2
cv_valid_train_sample_192875-v1_cv_valid_train_sample_192875;cv_valid_train_sample_192875-v1;cv_valid_train_sample_192875;a thin circle of bright metal showed between the top and the body of the cylinder;a thin circle of bright metal showed between the top and the body of the cylinder;2
cv_valid_train_sample_192876-v1_cv_valid_train_sample_192876;cv_valid_train_sample_192876-v1;cv_valid_train_sample_192876;if you pay attention to the present you can improve upon it;if you pay attention to the present you can improve upon it;2
cv_valid_train_sample_192877-v1_cv_valid_train_sample_192877;cv_valid_train_sample_192877-v1;cv_valid_train_sample_192877;i saw the shopkeeper struggling near the edge of the pit;i saw the shopkeeper struggling near the edge of the pit;2
cv_valid_train_sample_192878-v1_cv_valid_train_sample_192878;cv_valid_train_sample_192878-v1;cv_valid_train_sample_192878;he wanted to forget about the vision and return to his meditation;he wanted to forget about the vision and return to his meditation;2
cv_valid_train_sample_192879-v1_cv_valid_train_sample_192879;cv_valid_train_sample_192879-v1;cv_valid_train_sample_192879;what is a foreigner doing here asked another of the men;what is a foreigner doing here asked another of the men;2
cv_valid_train_sample_192880-v1_cv_valid_train_sample_192880;cv_valid_train_sample_192880-v1;cv_valid_train_sample_192880;i asked him to let me use the kitchen for a while the alchemist smiled;i asked him to let me use the kitchen for a while the alchemist smiled;2
cv_valid_train_sample_192881-v1_cv_valid_train_sample_192881;cv_valid_train_sample_192881-v1;cv_valid_train_sample_192881;despair is something that haunts us at night;despair is something that haunts us at night;2
cv_valid_train_sample_192882-v1_cv_valid_train_sample_192882;cv_valid_train_sample_192882-v1;cv_valid_train_sample_192882;get me walter burns;get me walter burns;2
cv_valid_train_sample_192883-v1_cv_valid_train_sample_192883;cv_valid_train_sample_192883-v1;cv_valid_train_sample_192883;can i get a woot woot;can i get a woot woot;2
cv_valid_train_sample_192884-v1_cv_valid_train_sample_192884;cv_valid_train_sample_192884-v1;cv_valid_train_sample_192884;the sticker was peeling from the item;the sticker was peeling from the item;2
cv_valid_train_sample_192885-v1_cv_valid_train_sample_192885;cv_valid_train_sample_192885-v1;cv_valid_train_sample_192885;he approached the mass and was surprised at the size and the shape;he approached the mass and was surprised at the size and the shape;2
cv_valid_train_sample_192886-v1_cv_valid_train_sample_192886;cv_valid_train_sample_192886-v1;cv_valid_train_sample_192886;in those days very few of the people had any idea about astronomy;in those days very few of the people had any idea about astronomy;2
cv_valid_train_sample_192887-v1_cv_valid_train_sample_192887;cv_valid_train_sample_192887-v1;cv_valid_train_sample_192887;dense clouds of smoke or dust can be seen through a powerful telescope;dense clouds of smoke or dust can be seen through a powerful telescope;2
cv_valid_train_sample_192888-v1_cv_valid_train_sample_192888;cv_valid_train_sample_192888-v1;cv_valid_train_sample_192888;you point to a trail of ants leading into the house;you point to a trail of ants leading into the house;2
cv_valid_train_sample_192889-v1_cv_valid_train_sample_192889;cv_valid_train_sample_192889-v1;cv_valid_train_sample_192889;he had come to the town only to find a woman who could interpret his dream;he had come to the town only to find a woman who could interpret his dream;2
cv_valid_train_sample_192890-v1_cv_valid_train_sample_192890;cv_valid_train_sample_192890-v1;cv_valid_train_sample_192890;it was the pure language of the world;it was the pure language of the world;2
cv_valid_train_sample_192891-v1_cv_valid_train_sample_192891;cv_valid_train_sample_192891-v1;cv_valid_train_sample_192891;it would be very useful if my web browser could synchronize all of its preferences not just some;it would be very useful if my web browser could synchronize all of its preferences not just some;2
cv_valid_train_sample_192892-v1_cv_valid_train_sample_192892;cv_valid_train_sample_192892-v1;cv_valid_train_sample_192892;he must be disguised to avoid encounters with thieves;he must be disguised to avoid encounters with thieves;2
cv_valid_train_sample_192893-v1_cv_valid_train_sample_192893;cv_valid_train_sample_192893-v1;cv_valid_train_sample_192893;vibrations of peace throughout the tent;vibrations of peace throughout the tent;2
cv_valid_train_sample_192894-v1_cv_valid_train_sample_192894;cv_valid_train_sample_192894-v1;cv_valid_train_sample_192894;i make my living forecasting the future for people he said;i make my living forecasting the future for people he said;2
cv_valid_train_sample_192895-v1_cv_valid_train_sample_192895;cv_valid_train_sample_192895-v1;cv_valid_train_sample_192895;the boy leapt as well but away from the alchemist;the boy leapt as well but away from the alchemist;2
cv_valid_train_sample_192896-v1_cv_valid_train_sample_192896;cv_valid_train_sample_192896-v1;cv_valid_train_sample_192896;the money is unimportant;the money is unimportant;2
cv_valid_train_sample_192897-v1_cv_valid_train_sample_192897;cv_valid_train_sample_192897-v1;cv_valid_train_sample_192897;but that was simply because my eye was tired;but that was simply because my eye was tired;2
cv_valid_train_sample_192898-v1_cv_valid_train_sample_192898;cv_valid_train_sample_192898-v1;cv_valid_train_sample_192898;stacey couldn't find the power switch;stacey couldn't find the power switch;2
cv_valid_train_sample_192899-v1_cv_valid_train_sample_192899;cv_valid_train_sample_192899-v1;cv_valid_train_sample_192899;my mind ran on the possibilities of its content;my mind ran on the possibilities of its content;2
cv_valid_train_sample_192900-v1_cv_valid_train_sample_192900;cv_valid_train_sample_192900-v1;cv_valid_train_sample_192900;worryingly the radio signal became weaker;worryingly the radio signal became weaker;2
cv_valid_train_sample_192901-v1_cv_valid_train_sample_192901;cv_valid_train_sample_192901-v1;cv_valid_train_sample_192901;i found a little crowd of about twenty people surrounding the huge hole;i found a little crowd of about twenty people surrounding the huge hole;2
cv_valid_train_sample_192902-v1_cv_valid_train_sample_192902;cv_valid_train_sample_192902-v1;cv_valid_train_sample_192902;about eleven i walked back to my home in maybury because nothing seemed to be happening;about eleven i walked back to my home in maybury because nothing seemed to be happening;2
cv_valid_train_sample_192903-v1_cv_valid_train_sample_192903;cv_valid_train_sample_192903-v1;cv_valid_train_sample_192903;those women are all card sharks don't be fooled;those women are all card sharks don't be fooled;2
cv_valid_train_sample_192904-v1_cv_valid_train_sample_192904;cv_valid_train_sample_192904-v1;cv_valid_train_sample_192904;i myself heard nothing of that;i myself heard nothing of that;2
cv_valid_train_sample_192905-v1_cv_valid_train_sample_192905;cv_valid_train_sample_192905-v1;cv_valid_train_sample_192905;other servants maintained the fires in the hookahs;other servants maintained the fires in the hookahs;2
cv_valid_train_sample_192906-v1_cv_valid_train_sample_192906;cv_valid_train_sample_192906-v1;cv_valid_train_sample_192906;have you got a mirror;have you got a mirror;2
cv_valid_train_sample_192907-v1_cv_valid_train_sample_192907;cv_valid_train_sample_192907-v1;cv_valid_train_sample_192907;strange images passed through my mind;strange images passed through my mind;2
cv_valid_train_sample_192908-v1_cv_valid_train_sample_192908;cv_valid_train_sample_192908-v1;cv_valid_train_sample_192908;i'm supposed to know my way around;i'm supposed to know my way around;2
cv_valid_train_sample_192909-v1_cv_valid_train_sample_192909;cv_valid_train_sample_192909-v1;cv_valid_train_sample_192909;goodbye said the boy;goodbye said the boy;2
cv_valid_train_sample_192910-v1_cv_valid_train_sample_192910;cv_valid_train_sample_192910-v1;cv_valid_train_sample_192910;she sends for you;she sends for you;2
cv_valid_train_sample_192911-v1_cv_valid_train_sample_192911;cv_valid_train_sample_192911-v1;cv_valid_train_sample_192911;what's the matter with you;what's the matter with you;2
cv_valid_train_sample_192912-v1_cv_valid_train_sample_192912;cv_valid_train_sample_192912-v1;cv_valid_train_sample_192912;the ceiling collapsed inwards;the ceiling collapsed inwards;2
cv_valid_train_sample_192913-v1_cv_valid_train_sample_192913;cv_valid_train_sample_192913-v1;cv_valid_train_sample_192913;if i send him to his dads he wont get bathed for a week;if i send him to his dads he wont get bathed for a week;2
cv_valid_train_sample_192914-v1_cv_valid_train_sample_192914;cv_valid_train_sample_192914-v1;cv_valid_train_sample_192914;i have the diet of a kid who found twenty dollars;i have the diet of a kid who found twenty dollars;2
cv_valid_train_sample_192915-v1_cv_valid_train_sample_192915;cv_valid_train_sample_192915-v1;cv_valid_train_sample_192915;stop calling me that;stop calling me that;2
cv_valid_train_sample_192916-v1_cv_valid_train_sample_192916;cv_valid_train_sample_192916-v1;cv_valid_train_sample_192916;they might even have become friends but the englishman closed off the conversation;they might even have become friends but the englishman closed off the conversation;2
cv_valid_train_sample_192917-v1_cv_valid_train_sample_192917;cv_valid_train_sample_192917-v1;cv_valid_train_sample_192917;but i didn't kill anybody;but i didn't kill anybody;2
cv_valid_train_sample_192918-v1_cv_valid_train_sample_192918;cv_valid_train_sample_192918-v1;cv_valid_train_sample_192918;show me where there is life out in the desert;show me where there is life out in the desert;2
cv_valid_train_sample_192919-v1_cv_valid_train_sample_192919;cv_valid_train_sample_192919-v1;cv_valid_train_sample_192919;and tomorrow his enemy would also be a part of that soul;and tomorrow his enemy would also be a part of that soul;2
cv_valid_train_sample_192920-v1_cv_valid_train_sample_192920;cv_valid_train_sample_192920-v1;cv_valid_train_sample_192920;what had been next to him five minutes ago was now at the other side;what had been next to him five minutes ago was now at the other side;2
cv_valid_train_sample_192921-v1_cv_valid_train_sample_192921;cv_valid_train_sample_192921-v1;cv_valid_train_sample_192921;the old man wore a breastplate of gold and he knew about my past;the old man wore a breastplate of gold and he knew about my past;2
cv_valid_train_sample_192922-v1_cv_valid_train_sample_192922;cv_valid_train_sample_192922-v1;cv_valid_train_sample_192922;that insane android continues to ignore me;that insane android continues to ignore me;2
cv_valid_train_sample_192923-v1_cv_valid_train_sample_192923;cv_valid_train_sample_192923-v1;cv_valid_train_sample_192923;and shouldn't they be garnished;and shouldn't they be garnished;2
cv_valid_train_sample_192924-v1_cv_valid_train_sample_192924;cv_valid_train_sample_192924-v1;cv_valid_train_sample_192924;he just got a new kite for his birthday;he just got a new kite for his birthday;2
cv_valid_train_sample_192925-v1_cv_valid_train_sample_192925;cv_valid_train_sample_192925-v1;cv_valid_train_sample_192925;if he were fed on time he wouldn't cry;if he were fed on time he wouldn't cry;2
cv_valid_train_sample_192926-v1_cv_valid_train_sample_192926;cv_valid_train_sample_192926-v1;cv_valid_train_sample_192926;there are many languages spoken by things the boy said;there are many languages spoken by things the boy said;2
cv_valid_train_sample_192927-v1_cv_valid_train_sample_192927;cv_valid_train_sample_192927-v1;cv_valid_train_sample_192927;he told fatima that at their next meeting;he told fatima that at their next meeting;2
cv_valid_train_sample_192928-v1_cv_valid_train_sample_192928;cv_valid_train_sample_192928-v1;cv_valid_train_sample_192928;his name was joseph;his name was joseph;2
cv_valid_train_sample_192929-v1_cv_valid_train_sample_192929;cv_valid_train_sample_192929-v1;cv_valid_train_sample_192929;the arabs laughed at him and the alchemist laughed along;the arabs laughed at him and the alchemist laughed along;2
cv_valid_train_sample_192930-v1_cv_valid_train_sample_192930;cv_valid_train_sample_192930-v1;cv_valid_train_sample_192930;my calendar was full that month;my calendar was full that month;2
cv_valid_train_sample_192931-v1_cv_valid_train_sample_192931;cv_valid_train_sample_192931-v1;cv_valid_train_sample_192931;i was impatient to see it opened;i was impatient to see it opened;2
cv_valid_train_sample_192932-v1_cv_valid_train_sample_192932;cv_valid_train_sample_192932-v1;cv_valid_train_sample_192932;you have enough gold to buy many sheep and many camels;you have enough gold to buy many sheep and many camels;2
cv_valid_train_sample_192933-v1_cv_valid_train_sample_192933;cv_valid_train_sample_192933-v1;cv_valid_train_sample_192933;a large portion of the cylinder had been uncovered;a large portion of the cylinder had been uncovered;2
cv_valid_train_sample_192934-v1_cv_valid_train_sample_192934;cv_valid_train_sample_192934-v1;cv_valid_train_sample_192934;there were lights in the upper windows of the houses when the people went to bed;there were lights in the upper windows of the houses when the people went to bed;2
cv_valid_train_sample_192935-v1_cv_valid_train_sample_192935;cv_valid_train_sample_192935-v1;cv_valid_train_sample_192935;and continue to pay heed to the omens;and continue to pay heed to the omens;2
cv_valid_train_sample_192936-v1_cv_valid_train_sample_192936;cv_valid_train_sample_192936-v1;cv_valid_train_sample_192936;he prepared himself a sandwich and drank some hot tea from a crystal glass;he prepared himself a sandwich and drank some hot tea from a crystal glass;2
cv_valid_train_sample_192937-v1_cv_valid_train_sample_192937;cv_valid_train_sample_192937-v1;cv_valid_train_sample_192937;he had never imagined that questions about life would be of such importance to a shepherd;he had never imagined that questions about life would be of such importance to a shepherd;2
cv_valid_train_sample_192938-v1_cv_valid_train_sample_192938;cv_valid_train_sample_192938-v1;cv_valid_train_sample_192938;the smell was noxious;the smell was noxious;2
cv_valid_train_sample_192939-v1_cv_valid_train_sample_192939;cv_valid_train_sample_192939-v1;cv_valid_train_sample_192939;it's not easy to find the philosopher's stone said the englishman;it's not easy to find the philosopher's stone said the englishman;2
cv_valid_train_sample_192940-v1_cv_valid_train_sample_192940;cv_valid_train_sample_192940-v1;cv_valid_train_sample_192940;i have to find a man who knows that universal language;i have to find a man who knows that universal language;2
cv_valid_train_sample_192941-v1_cv_valid_train_sample_192941;cv_valid_train_sample_192941-v1;cv_valid_train_sample_192941;maybe tomorrow said the boy moving away;maybe tomorrow said the boy moving away;2
cv_valid_train_sample_192942-v1_cv_valid_train_sample_192942;cv_valid_train_sample_192942-v1;cv_valid_train_sample_192942;he looked like an arab which was not unusual in those parts;he looked like an arab which was not unusual in those parts;2
cv_valid_train_sample_192943-v1_cv_valid_train_sample_192943;cv_valid_train_sample_192943-v1;cv_valid_train_sample_192943;he had surprised himself with the thought;he had surprised himself with the thought;2
cv_valid_train_sample_192944-v1_cv_valid_train_sample_192944;cv_valid_train_sample_192944-v1;cv_valid_train_sample_192944;but then he remembered that he wasn't going to have to pay anything;but then he remembered that he wasn't going to have to pay anything;2
cv_valid_train_sample_192945-v1_cv_valid_train_sample_192945;cv_valid_train_sample_192945-v1;cv_valid_train_sample_192945;i'm in a drugstore;i'm in a drugstore;2
cv_valid_train_sample_192946-v1_cv_valid_train_sample_192946;cv_valid_train_sample_192946-v1;cv_valid_train_sample_192946;learn to recognize omens and follow them the old king had said;learn to recognize omens and follow them the old king had said;2
cv_valid_train_sample_192947-v1_cv_valid_train_sample_192947;cv_valid_train_sample_192947-v1;cv_valid_train_sample_192947;the falcon's beak carries bits of me myself the desert said;the falcon's beak carries bits of me myself the desert said;2
cv_valid_train_sample_192948-v1_cv_valid_train_sample_192948;cv_valid_train_sample_192948-v1;cv_valid_train_sample_192948;the omens will begin insistently to speak of it and you'll try to ignore them;the omens will begin insistently to speak of it and you'll try to ignore them;2
cv_valid_train_sample_192949-v1_cv_valid_train_sample_192949;cv_valid_train_sample_192949-v1;cv_valid_train_sample_192949;go back to watching the caravan he said;go back to watching the caravan he said;2
cv_valid_train_sample_192950-v1_cv_valid_train_sample_192950;cv_valid_train_sample_192950-v1;cv_valid_train_sample_192950;patrick has terminal cancer;patrick has terminal cancer;2
cv_valid_train_sample_192951-v1_cv_valid_train_sample_192951;cv_valid_train_sample_192951-v1;cv_valid_train_sample_192951;without responding the guard entered the tent where he remained for some time;without responding the guard entered the tent where he remained for some time;2
cv_valid_train_sample_192952-v1_cv_valid_train_sample_192952;cv_valid_train_sample_192952-v1;cv_valid_train_sample_192952;i'm going into the desert the man answered turning back to his reading;i'm going into the desert the man answered turning back to his reading;2
cv_valid_train_sample_192953-v1_cv_valid_train_sample_192953;cv_valid_train_sample_192953-v1;cv_valid_train_sample_192953;the immense collection of people and animals began to travel faster;the immense collection of people and animals began to travel faster;2
cv_valid_train_sample_192954-v1_cv_valid_train_sample_192954;cv_valid_train_sample_192954-v1;cv_valid_train_sample_192954;and what do you do in salem he insisted;and what do you do in salem he insisted;2
cv_valid_train_sample_192955-v1_cv_valid_train_sample_192955;cv_valid_train_sample_192955-v1;cv_valid_train_sample_192955;ill join you in a minute after i lock my bike;ill join you in a minute after i lock my bike;2
cv_valid_train_sample_192956-v1_cv_valid_train_sample_192956;cv_valid_train_sample_192956-v1;cv_valid_train_sample_192956;they say it's a fake;they say it's a fake;2
cv_valid_train_sample_192957-v1_cv_valid_train_sample_192957;cv_valid_train_sample_192957-v1;cv_valid_train_sample_192957;so then try he said to the englishman;so then try he said to the englishman;2
cv_valid_train_sample_192958-v1_cv_valid_train_sample_192958;cv_valid_train_sample_192958-v1;cv_valid_train_sample_192958;and the alchemist understood that the boy's heart had returned to the soul of the world;and the alchemist understood that the boy's heart had returned to the soul of the world;2
cv_valid_train_sample_192959-v1_cv_valid_train_sample_192959;cv_valid_train_sample_192959-v1;cv_valid_train_sample_192959;even then he hardly understood what this meant;even then he hardly understood what this meant;2
cv_valid_train_sample_192960-v1_cv_valid_train_sample_192960;cv_valid_train_sample_192960-v1;cv_valid_train_sample_192960;i'm surprised the boy said;i'm surprised the boy said;2
cv_valid_train_sample_192961-v1_cv_valid_train_sample_192961;cv_valid_train_sample_192961-v1;cv_valid_train_sample_192961;there was a hole there among the stones;there was a hole there among the stones;2
cv_valid_train_sample_192962-v1_cv_valid_train_sample_192962;cv_valid_train_sample_192962-v1;cv_valid_train_sample_192962;the sun shines so brightly;the sun shines so brightly;2
cv_valid_train_sample_192963-v1_cv_valid_train_sample_192963;cv_valid_train_sample_192963-v1;cv_valid_train_sample_192963;can i help you asked the man behind the window;can i help you asked the man behind the window;2
cv_valid_train_sample_192964-v1_cv_valid_train_sample_192964;cv_valid_train_sample_192964-v1;cv_valid_train_sample_192964;the arab accepted them without a word;the arab accepted them without a word;2
cv_valid_train_sample_192965-v1_cv_valid_train_sample_192965;cv_valid_train_sample_192965-v1;cv_valid_train_sample_192965;there was a murmur from the crowd;there was a murmur from the crowd;2
cv_valid_train_sample_192966-v1_cv_valid_train_sample_192966;cv_valid_train_sample_192966-v1;cv_valid_train_sample_192966;raisins are delicious;raisins are delicious;2
cv_valid_train_sample_192967-v1_cv_valid_train_sample_192967;cv_valid_train_sample_192967-v1;cv_valid_train_sample_192967;then came the night of the first falling star;then came the night of the first falling star;2
cv_valid_train_sample_192968-v1_cv_valid_train_sample_192968;cv_valid_train_sample_192968-v1;cv_valid_train_sample_192968;its lower end was still embedded;its lower end was still embedded;2
cv_valid_train_sample_192969-v1_cv_valid_train_sample_192969;cv_valid_train_sample_192969-v1;cv_valid_train_sample_192969;we just lost our heads and acted like a mob;we just lost our heads and acted like a mob;2
