cv_valid_train_sample_191929-v1_cv_valid_train_sample_191929;cv_valid_train_sample_191929-v1;cv_valid_train_sample_191929;he should respect tradition;he should respect tradition;2
cv_valid_train_sample_191930-v1_cv_valid_train_sample_191930;cv_valid_train_sample_191930-v1;cv_valid_train_sample_191930;he sat looking at the sky for a long time;he sat looking at the sky for a long time;2
cv_valid_train_sample_191931-v1_cv_valid_train_sample_191931;cv_valid_train_sample_191931-v1;cv_valid_train_sample_191931;a boy came running towards me;a boy came running towards me;2
cv_valid_train_sample_191932-v1_cv_valid_train_sample_191932;cv_valid_train_sample_191932-v1;cv_valid_train_sample_191932;there are powerful forces on both sides and the war is important to both armies;there are powerful forces on both sides and the war is important to both armies;2
cv_valid_train_sample_191933-v1_cv_valid_train_sample_191933;cv_valid_train_sample_191933-v1;cv_valid_train_sample_191933;from that day on it was the desert that would be important;from that day on it was the desert that would be important;2
cv_valid_train_sample_191934-v1_cv_valid_train_sample_191934;cv_valid_train_sample_191934-v1;cv_valid_train_sample_191934;show me some gratitude;show me some gratitude;2
cv_valid_train_sample_191935-v1_cv_valid_train_sample_191935;cv_valid_train_sample_191935-v1;cv_valid_train_sample_191935;it's not easy to find the philosopher's stone said the englishman;it's not easy to find the philosopher's stone said the englishman;2
cv_valid_train_sample_191936-v1_cv_valid_train_sample_191936;cv_valid_train_sample_191936-v1;cv_valid_train_sample_191936;tomorrow sell your camel and buy a horse;tomorrow sell your camel and buy a horse;2
cv_valid_train_sample_191937-v1_cv_valid_train_sample_191937;cv_valid_train_sample_191937-v1;cv_valid_train_sample_191937;maybe it was because they moved around so much;maybe it was because they moved around so much;2
cv_valid_train_sample_191938-v1_cv_valid_train_sample_191938;cv_valid_train_sample_191938-v1;cv_valid_train_sample_191938;i thought you were chasing me;i thought you were chasing me;2
cv_valid_train_sample_191939-v1_cv_valid_train_sample_191939;cv_valid_train_sample_191939-v1;cv_valid_train_sample_191939;his eyes filled with tears as he spoke of the prophet;his eyes filled with tears as he spoke of the prophet;2
cv_valid_train_sample_191940-v1_cv_valid_train_sample_191940;cv_valid_train_sample_191940-v1;cv_valid_train_sample_191940;fortunately you can configure chrome to set up a debugging server;fortunately you can configure chrome to set up a debugging server;2
cv_valid_train_sample_191941-v1_cv_valid_train_sample_191941;cv_valid_train_sample_191941-v1;cv_valid_train_sample_191941;he could sell the stones and buy a return ticket;he could sell the stones and buy a return ticket;2
cv_valid_train_sample_191942-v1_cv_valid_train_sample_191942;cv_valid_train_sample_191942-v1;cv_valid_train_sample_191942;you'll be the only one who'll swipe any of it;you'll be the only one who'll swipe any of it;2
cv_valid_train_sample_191943-v1_cv_valid_train_sample_191943;cv_valid_train_sample_191943-v1;cv_valid_train_sample_191943;other servants maintained the fires in the hookahs;other servants maintained the fires in the hookahs;2
cv_valid_train_sample_191944-v1_cv_valid_train_sample_191944;cv_valid_train_sample_191944-v1;cv_valid_train_sample_191944;i wished i had a light to smoke by;i wished i had a light to smoke by;2
cv_valid_train_sample_191945-v1_cv_valid_train_sample_191945;cv_valid_train_sample_191945-v1;cv_valid_train_sample_191945;the boy awoke as the sun rose;the boy awoke as the sun rose;2
cv_valid_train_sample_191946-v1_cv_valid_train_sample_191946;cv_valid_train_sample_191946-v1;cv_valid_train_sample_191946;not always in this way but i always appear in one form or another;not always in this way but i always appear in one form or another;2
cv_valid_train_sample_191947-v1_cv_valid_train_sample_191947;cv_valid_train_sample_191947-v1;cv_valid_train_sample_191947;but he didn't need to worry about that right now;but he didn't need to worry about that right now;2
cv_valid_train_sample_191948-v1_cv_valid_train_sample_191948;cv_valid_train_sample_191948-v1;cv_valid_train_sample_191948;everything you need to know you have learned through your journey;everything you need to know you have learned through your journey;2
cv_valid_train_sample_191949-v1_cv_valid_train_sample_191949;cv_valid_train_sample_191949-v1;cv_valid_train_sample_191949;an alchemist said the alchemist;an alchemist said the alchemist;2
cv_valid_train_sample_191950-v1_cv_valid_train_sample_191950;cv_valid_train_sample_191950-v1;cv_valid_train_sample_191950;the wind began to pick up;the wind began to pick up;2
cv_valid_train_sample_191951-v1_cv_valid_train_sample_191951;cv_valid_train_sample_191951-v1;cv_valid_train_sample_191951;the boy approached her to ask about the alchemist;the boy approached her to ask about the alchemist;2
cv_valid_train_sample_191952-v1_cv_valid_train_sample_191952;cv_valid_train_sample_191952-v1;cv_valid_train_sample_191952;he left without saying goodbye to the crystal merchant;he left without saying goodbye to the crystal merchant;2
cv_valid_train_sample_191953-v1_cv_valid_train_sample_191953;cv_valid_train_sample_191953-v1;cv_valid_train_sample_191953;the englishman was unable to sleep one night;the englishman was unable to sleep one night;2
cv_valid_train_sample_191954-v1_cv_valid_train_sample_191954;cv_valid_train_sample_191954-v1;cv_valid_train_sample_191954;don't say anything fatima interrupted;don't say anything fatima interrupted;2
cv_valid_train_sample_191955-v1_cv_valid_train_sample_191955;cv_valid_train_sample_191955-v1;cv_valid_train_sample_191955;with a bag of marshmallows;with a bag of marshmallows;2
cv_valid_train_sample_191956-v1_cv_valid_train_sample_191956;cv_valid_train_sample_191956-v1;cv_valid_train_sample_191956;i don't blame you;i don't blame you;2
cv_valid_train_sample_191957-v1_cv_valid_train_sample_191957;cv_valid_train_sample_191957-v1;cv_valid_train_sample_191957;they provided warnings about thieves and barbarian tribes;they provided warnings about thieves and barbarian tribes;2
cv_valid_train_sample_191958-v1_cv_valid_train_sample_191958;cv_valid_train_sample_191958-v1;cv_valid_train_sample_191958;because i've always heard about them the boy answered saying nothing about his dream;because i've always heard about them the boy answered saying nothing about his dream;2
cv_valid_train_sample_191959-v1_cv_valid_train_sample_191959;cv_valid_train_sample_191959-v1;cv_valid_train_sample_191959;i needed immediate access;i needed immediate access;2
cv_valid_train_sample_191960-v1_cv_valid_train_sample_191960;cv_valid_train_sample_191960-v1;cv_valid_train_sample_191960;i saw a young man standing on the cylinder and trying to scramble out of the hole again;i saw a young man standing on the cylinder and trying to scramble out of the hole again;2
cv_valid_train_sample_191961-v1_cv_valid_train_sample_191961;cv_valid_train_sample_191961-v1;cv_valid_train_sample_191961;i'm going to them;i'm going to them;2
cv_valid_train_sample_191962-v1_cv_valid_train_sample_191962;cv_valid_train_sample_191962-v1;cv_valid_train_sample_191962;i just don't trust anyone who says they've never had hamburger helper;i just don't trust anyone who says they ve never had hamburger helper;2
cv_valid_train_sample_191963-v1_cv_valid_train_sample_191963;cv_valid_train_sample_191963-v1;cv_valid_train_sample_191963;some went away while i was there and other people came;some went away while i was there and other people came;2
cv_valid_train_sample_191964-v1_cv_valid_train_sample_191964;cv_valid_train_sample_191964-v1;cv_valid_train_sample_191964;one is loved because one is loved;one is loved because one is loved;2
cv_valid_train_sample_191965-v1_cv_valid_train_sample_191965;cv_valid_train_sample_191965-v1;cv_valid_train_sample_191965;an huge hole had been made by the impact of the projectile;an huge hole had been made by the impact of the projectile;2
cv_valid_train_sample_191966-v1_cv_valid_train_sample_191966;cv_valid_train_sample_191966-v1;cv_valid_train_sample_191966;the alchemist followed as the boy's horse ran for almost half an hour;the alchemist followed as the boy's horse ran for almost half an hour;2
cv_valid_train_sample_191967-v1_cv_valid_train_sample_191967;cv_valid_train_sample_191967-v1;cv_valid_train_sample_191967;i'm a woman of the desert she said averting her face;i'm a woman of the desert she said averting her face;2
cv_valid_train_sample_191968-v1_cv_valid_train_sample_191968;cv_valid_train_sample_191968-v1;cv_valid_train_sample_191968;a boy came running towards me;a boy came running towards me;2
cv_valid_train_sample_191969-v1_cv_valid_train_sample_191969;cv_valid_train_sample_191969-v1;cv_valid_train_sample_191969;the hand that evokes love and creates a twin soul for every person in the world;the hand that evokes love and creates a twin soul for every person in the world;2
cv_valid_train_sample_191970-v1_cv_valid_train_sample_191970;cv_valid_train_sample_191970-v1;cv_valid_train_sample_191970;what's the idea here;what's the idea here;2
cv_valid_train_sample_191971-v1_cv_valid_train_sample_191971;cv_valid_train_sample_191971-v1;cv_valid_train_sample_191971;scattered groups of people were hurrying from the direction of woking;scattered groups of people were hurrying from the direction of woking;2
cv_valid_train_sample_191972-v1_cv_valid_train_sample_191972;cv_valid_train_sample_191972-v1;cv_valid_train_sample_191972;strange images passed through my mind;strange images passed through my mind;2
cv_valid_train_sample_191973-v1_cv_valid_train_sample_191973;cv_valid_train_sample_191973-v1;cv_valid_train_sample_191973;i need one more;i need one more;2
cv_valid_train_sample_191974-v1_cv_valid_train_sample_191974;cv_valid_train_sample_191974-v1;cv_valid_train_sample_191974;the boy noticed that the owner of the bar stood nearby listening attentively to their conversation;the boy noticed that the owner of the bar stood nearby listening attentively to their conversation;2
cv_valid_train_sample_191975-v1_cv_valid_train_sample_191975;cv_valid_train_sample_191975-v1;cv_valid_train_sample_191975;the jacket had a purpose and so did the boy;the jacket had a purpose and so did the boy;2
cv_valid_train_sample_191976-v1_cv_valid_train_sample_191976;cv_valid_train_sample_191976-v1;cv_valid_train_sample_191976;he told fatima that at their next meeting;he told fatima that at their next meeting;2
cv_valid_train_sample_191977-v1_cv_valid_train_sample_191977;cv_valid_train_sample_191977-v1;cv_valid_train_sample_191977;i think they perceived that nothing was to be done at the moment;i think they perceived that nothing was to be done at the moment;2
cv_valid_train_sample_191978-v1_cv_valid_train_sample_191978;cv_valid_train_sample_191978-v1;cv_valid_train_sample_191978;no doubt the impact had caused a flash of fire;no doubt the impact had caused a flash of fire;2
cv_valid_train_sample_191979-v1_cv_valid_train_sample_191979;cv_valid_train_sample_191979-v1;cv_valid_train_sample_191979;he has done so much ghostwriting that he starts to feel like a ghost too;he has done so much ghostwriting that he starts to feel like a ghost too;2
cv_valid_train_sample_191980-v1_cv_valid_train_sample_191980;cv_valid_train_sample_191980-v1;cv_valid_train_sample_191980;but i like it that way;but i like it that way;2
cv_valid_train_sample_191981-v1_cv_valid_train_sample_191981;cv_valid_train_sample_191981-v1;cv_valid_train_sample_191981;the boy's heart began to speak of fear;the boy's heart began to speak of fear;2
cv_valid_train_sample_191982-v1_cv_valid_train_sample_191982;cv_valid_train_sample_191982-v1;cv_valid_train_sample_191982;he expertly gutted the rabbit;he expertly gutted the rabbit;2
cv_valid_train_sample_191983-v1_cv_valid_train_sample_191983;cv_valid_train_sample_191983-v1;cv_valid_train_sample_191983;there was no response from the elders;there was no response from the elders;2
cv_valid_train_sample_191984-v1_cv_valid_train_sample_191984;cv_valid_train_sample_191984-v1;cv_valid_train_sample_191984;all new generations of gpus support tesselation in hardware;all new generations of gpus support tesselation in hardware;2
cv_valid_train_sample_191985-v1_cv_valid_train_sample_191985;cv_valid_train_sample_191985-v1;cv_valid_train_sample_191985;has aunt stephanie come in yet;has aunt stephanie come in yet;2
cv_valid_train_sample_191986-v1_cv_valid_train_sample_191986;cv_valid_train_sample_191986-v1;cv_valid_train_sample_191986;it had told him to dig where his tears fell;it had told him to dig where his tears fell;2
cv_valid_train_sample_191987-v1_cv_valid_train_sample_191987;cv_valid_train_sample_191987-v1;cv_valid_train_sample_191987;but the king of salem hoped desperately that the boy would be successful;but the king of salem hoped desperately that the boy would be successful;2
cv_valid_train_sample_191988-v1_cv_valid_train_sample_191988;cv_valid_train_sample_191988-v1;cv_valid_train_sample_191988;who told you about omens the boy's interest was increasing by the moment;who told you about omens the boy's interest was increasing by the moment;2
cv_valid_train_sample_191989-v1_cv_valid_train_sample_191989;cv_valid_train_sample_191989-v1;cv_valid_train_sample_191989;strange images passed through my mind;strange images passed through my mind;2
cv_valid_train_sample_191990-v1_cv_valid_train_sample_191990;cv_valid_train_sample_191990-v1;cv_valid_train_sample_191990;the wind screamed with delight and blew harder than ever;the wind screamed with delight and blew harder than ever;2
cv_valid_train_sample_191991-v1_cv_valid_train_sample_191991;cv_valid_train_sample_191991-v1;cv_valid_train_sample_191991;i'm supposed to know my way around;i'm supposed to know my way around;2
cv_valid_train_sample_191992-v1_cv_valid_train_sample_191992;cv_valid_train_sample_191992-v1;cv_valid_train_sample_191992;most of them were staring quietly at the big table;most of them were staring quietly at the big table;2
cv_valid_train_sample_191993-v1_cv_valid_train_sample_191993;cv_valid_train_sample_191993-v1;cv_valid_train_sample_191993;never mind those guys;never mind those guys;2
cv_valid_train_sample_191994-v1_cv_valid_train_sample_191994;cv_valid_train_sample_191994-v1;cv_valid_train_sample_191994;robin had some sort of date with tracy;robin had some sort of date with tracy;2
cv_valid_train_sample_191995-v1_cv_valid_train_sample_191995;cv_valid_train_sample_191995-v1;cv_valid_train_sample_191995;give me my book the boy said;give me my book the boy said;2
cv_valid_train_sample_191996-v1_cv_valid_train_sample_191996;cv_valid_train_sample_191996-v1;cv_valid_train_sample_191996;we took all the chances;we took all the chances;2
cv_valid_train_sample_191997-v1_cv_valid_train_sample_191997;cv_valid_train_sample_191997-v1;cv_valid_train_sample_191997;his life and his path had always provided him with enough omens;his life and his path had always provided him with enough omens;2
cv_valid_train_sample_191998-v1_cv_valid_train_sample_191998;cv_valid_train_sample_191998-v1;cv_valid_train_sample_191998;the newspaper articles had prepared everyone for the reception of the idea;the newspaper articles had prepared everyone for the reception of the idea;2
cv_valid_train_sample_191999-v1_cv_valid_train_sample_191999;cv_valid_train_sample_191999-v1;cv_valid_train_sample_191999;from here on you will be alone the alchemist said;from here on you will be alone the alchemist said;2
cv_valid_train_sample_192000-v1_cv_valid_train_sample_192000;cv_valid_train_sample_192000-v1;cv_valid_train_sample_192000;lighthouses in a foggy world;lighthouses in a foggy world;2
cv_valid_train_sample_192001-v1_cv_valid_train_sample_192001;cv_valid_train_sample_192001-v1;cv_valid_train_sample_192001;many people are traumatized after this sailing accident and need intensive care;many people are traumatized after this sailing accident and need intensive care;2
cv_valid_train_sample_192002-v1_cv_valid_train_sample_192002;cv_valid_train_sample_192002-v1;cv_valid_train_sample_192002;opening the source code can be a measure to create trust in software;opening the source code can be a measure to create trust in software;2
cv_valid_train_sample_192003-v1_cv_valid_train_sample_192003;cv_valid_train_sample_192003-v1;cv_valid_train_sample_192003;he approached the mass and was surprised at the size and the shape;he approached the mass and was surprised at the size and the shape;2
cv_valid_train_sample_192004-v1_cv_valid_train_sample_192004;cv_valid_train_sample_192004-v1;cv_valid_train_sample_192004;at that point the omens will tell you that your treasure is buried forever;at that point the omens will tell you that your treasure is buried forever;2
cv_valid_train_sample_192005-v1_cv_valid_train_sample_192005;cv_valid_train_sample_192005-v1;cv_valid_train_sample_192005;i thought you were gone;i thought you were gone;2
cv_valid_train_sample_192006-v1_cv_valid_train_sample_192006;cv_valid_train_sample_192006-v1;cv_valid_train_sample_192006;the router overheated and needed to be restarted;the router overheated and needed to be restarted;2
cv_valid_train_sample_192007-v1_cv_valid_train_sample_192007;cv_valid_train_sample_192007-v1;cv_valid_train_sample_192007;he didn't need to seek out the old woman for this;he didn't need to seek out the old woman for this;2
cv_valid_train_sample_192008-v1_cv_valid_train_sample_192008;cv_valid_train_sample_192008-v1;cv_valid_train_sample_192008;this is jon davis;this is jon davis;2
cv_valid_train_sample_192009-v1_cv_valid_train_sample_192009;cv_valid_train_sample_192009-v1;cv_valid_train_sample_192009;but he found it much more interesting to observe the caravan and listen to the wind;but he found it much more interesting to observe the caravan and listen to the wind;2
cv_valid_train_sample_192010-v1_cv_valid_train_sample_192010;cv_valid_train_sample_192010-v1;cv_valid_train_sample_192010;the other son was a poet and delighted all of rome with his beautiful verses;the other son was a poet and delighted all of rome with his beautiful verses;2
cv_valid_train_sample_192011-v1_cv_valid_train_sample_192011;cv_valid_train_sample_192011-v1;cv_valid_train_sample_192011;most of them were staring quietly at the big table;most of them were staring quietly at the big table;2
cv_valid_train_sample_192012-v1_cv_valid_train_sample_192012;cv_valid_train_sample_192012-v1;cv_valid_train_sample_192012;the boy accustomed to recognizing omens spoke to the merchant;the boy accustomed to recognizing omens spoke to the merchant;2
cv_valid_train_sample_192013-v1_cv_valid_train_sample_192013;cv_valid_train_sample_192013-v1;cv_valid_train_sample_192013;but nowhere could he find his new companion;but nowhere could he find his new companion;2
cv_valid_train_sample_192014-v1_cv_valid_train_sample_192014;cv_valid_train_sample_192014-v1;cv_valid_train_sample_192014;don't try to move;don't try to move;2
cv_valid_train_sample_192015-v1_cv_valid_train_sample_192015;cv_valid_train_sample_192015-v1;cv_valid_train_sample_192015;that he wanted to travel;that he wanted to travel;2
cv_valid_train_sample_192016-v1_cv_valid_train_sample_192016;cv_valid_train_sample_192016-v1;cv_valid_train_sample_192016;well then stand up;well then stand up;2
cv_valid_train_sample_192017-v1_cv_valid_train_sample_192017;cv_valid_train_sample_192017-v1;cv_valid_train_sample_192017;they provided warnings about thieves and barbarian tribes;they provided warnings about thieves and barbarian tribes;2
cv_valid_train_sample_192018-v1_cv_valid_train_sample_192018;cv_valid_train_sample_192018-v1;cv_valid_train_sample_192018;everything in the universe evolved he said;everything in the universe evolved he said;2
cv_valid_train_sample_192019-v1_cv_valid_train_sample_192019;cv_valid_train_sample_192019-v1;cv_valid_train_sample_192019;he had been to the village only once the year before;he had been to the village only once the year before;2
cv_valid_train_sample_192020-v1_cv_valid_train_sample_192020;cv_valid_train_sample_192020-v1;cv_valid_train_sample_192020;an old man with a breastplate of gold wouldn't have lied just to acquire six sheep;an old man with a breastplate of gold wouldn't have lied just to acquire six sheep;2
cv_valid_train_sample_192021-v1_cv_valid_train_sample_192021;cv_valid_train_sample_192021-v1;cv_valid_train_sample_192021;then he sat in the sunfilled doorway smoking the hookah;then he sat in the sunfilled doorway smoking the hookah;2
cv_valid_train_sample_192022-v1_cv_valid_train_sample_192022;cv_valid_train_sample_192022-v1;cv_valid_train_sample_192022;he placed the dvd into the player;he placed the dvd into the player;2
cv_valid_train_sample_192023-v1_cv_valid_train_sample_192023;cv_valid_train_sample_192023-v1;cv_valid_train_sample_192023;my mind ran on the possibilities of its content;my mind ran on the possibilities of its content;2
cv_valid_train_sample_192024-v1_cv_valid_train_sample_192024;cv_valid_train_sample_192024-v1;cv_valid_train_sample_192024;there was a murmur from the crowd;there was a murmur from the crowd;2
cv_valid_train_sample_192025-v1_cv_valid_train_sample_192025;cv_valid_train_sample_192025-v1;cv_valid_train_sample_192025;you can't bribe me;you can't bribe me;2
cv_valid_train_sample_192026-v1_cv_valid_train_sample_192026;cv_valid_train_sample_192026-v1;cv_valid_train_sample_192026;some of the grey ash was falling off the circular edge;some of the grey ash was falling off the circular edge;2
cv_valid_train_sample_192027-v1_cv_valid_train_sample_192027;cv_valid_train_sample_192027-v1;cv_valid_train_sample_192027;i don't believe it;i don't believe it;2
cv_valid_train_sample_192028-v1_cv_valid_train_sample_192028;cv_valid_train_sample_192028-v1;cv_valid_train_sample_192028;close shot of the colonel;close shot of the colonel;2
cv_valid_train_sample_192029-v1_cv_valid_train_sample_192029;cv_valid_train_sample_192029-v1;cv_valid_train_sample_192029;the boy brought his horse closer;the boy brought his horse closer;2
cv_valid_train_sample_192030-v1_cv_valid_train_sample_192030;cv_valid_train_sample_192030-v1;cv_valid_train_sample_192030;and the sand and gravel had been flung violently in every direction;and the sand and gravel had been flung violently in every direction;2
cv_valid_train_sample_192031-v1_cv_valid_train_sample_192031;cv_valid_train_sample_192031-v1;cv_valid_train_sample_192031;then get out of here;then get out of here;2
cv_valid_train_sample_192032-v1_cv_valid_train_sample_192032;cv_valid_train_sample_192032-v1;cv_valid_train_sample_192032;it's like the flight of those two hawks it can't be understood by reason alone;it's like the flight of those two hawks it can't be understood by reason alone;2
cv_valid_train_sample_192033-v1_cv_valid_train_sample_192033;cv_valid_train_sample_192033-v1;cv_valid_train_sample_192033;the boy reminded the old man that he had said something about hidden treasure;the boy reminded the old man that he had said something about hidden treasure;2
cv_valid_train_sample_192034-v1_cv_valid_train_sample_192034;cv_valid_train_sample_192034-v1;cv_valid_train_sample_192034;the authors claim to specifically address variations due to geometric transformations in the acquired images;the authors claim to specifically address variations due to geometric transformations in the acquired images;2
cv_valid_train_sample_192035-v1_cv_valid_train_sample_192035;cv_valid_train_sample_192035-v1;cv_valid_train_sample_192035;and if you improve on the present what comes later will also be better;and if you improve on the present what comes later will also be better;2
cv_valid_train_sample_192036-v1_cv_valid_train_sample_192036;cv_valid_train_sample_192036-v1;cv_valid_train_sample_192036;he appeared with the first stars of evening;he appeared with the first stars of evening;2
cv_valid_train_sample_192037-v1_cv_valid_train_sample_192037;cv_valid_train_sample_192037-v1;cv_valid_train_sample_192037;it could be computed in many ways which would give more or less equivalent results;it could be computed in many ways which would give more or less equivalent results;2
cv_valid_train_sample_192038-v1_cv_valid_train_sample_192038;cv_valid_train_sample_192038-v1;cv_valid_train_sample_192038;some of those who saw its flight say it travelled with a hissing sound;some of those who saw its flight say it travelled with a hissing sound;2
cv_valid_train_sample_192039-v1_cv_valid_train_sample_192039;cv_valid_train_sample_192039-v1;cv_valid_train_sample_192039;people saw me coming and welcomed me he thought;people saw me coming and welcomed me he thought;2
cv_valid_train_sample_192040-v1_cv_valid_train_sample_192040;cv_valid_train_sample_192040-v1;cv_valid_train_sample_192040;the man preferred basil over parsley;the man preferred basil over parsley;2
cv_valid_train_sample_192041-v1_cv_valid_train_sample_192041;cv_valid_train_sample_192041-v1;cv_valid_train_sample_192041;why couldn't you just look at his feet;why couldn't you just look at his feet;2
cv_valid_train_sample_192042-v1_cv_valid_train_sample_192042;cv_valid_train_sample_192042-v1;cv_valid_train_sample_192042;hires two personal trainers and make one of them train the other one;hires two personal trainers and make one of them train the other one;2
cv_valid_train_sample_192043-v1_cv_valid_train_sample_192043;cv_valid_train_sample_192043-v1;cv_valid_train_sample_192043;he was sure the girl would never understand;he was sure the girl would never understand;2
cv_valid_train_sample_192044-v1_cv_valid_train_sample_192044;cv_valid_train_sample_192044-v1;cv_valid_train_sample_192044;the burning fire had been extinguished;the burning fire had been extinguished;2
