cv_valid_train_sample_194735-v1_cv_valid_train_sample_194735;cv_valid_train_sample_194735-v1;cv_valid_train_sample_194735;strange images passed through my mind;strange images passed through my mind;2
cv_valid_train_sample_194736-v1_cv_valid_train_sample_194736;cv_valid_train_sample_194736-v1;cv_valid_train_sample_194736;the wind has many names;the wind has many names;2
cv_valid_train_sample_194737-v1_cv_valid_train_sample_194737;cv_valid_train_sample_194737-v1;cv_valid_train_sample_194737;and continue to pay heed to the omens;and continue to pay heed to the omens;2
cv_valid_train_sample_194738-v1_cv_valid_train_sample_194738;cv_valid_train_sample_194738-v1;cv_valid_train_sample_194738;i thought about whether we should find coins and models in it and so on;i thought about whether we should find coins and models in it and so on;2
cv_valid_train_sample_194739-v1_cv_valid_train_sample_194739;cv_valid_train_sample_194739-v1;cv_valid_train_sample_194739;fatima appeared at the entrance to the tent;fatima appeared at the entrance to the tent;2
cv_valid_train_sample_194740-v1_cv_valid_train_sample_194740;cv_valid_train_sample_194740-v1;cv_valid_train_sample_194740;today im making the internet more inclusive;today im making the internet more inclusive;2
cv_valid_train_sample_194741-v1_cv_valid_train_sample_194741;cv_valid_train_sample_194741-v1;cv_valid_train_sample_194741;can i help you;can i help you;2
cv_valid_train_sample_194742-v1_cv_valid_train_sample_194742;cv_valid_train_sample_194742-v1;cv_valid_train_sample_194742;maybe because that wasn't really his dream;maybe because that wasn't really his dream;2
cv_valid_train_sample_194743-v1_cv_valid_train_sample_194743;cv_valid_train_sample_194743-v1;cv_valid_train_sample_194743;many of them had been right about what they said while some had been wrong;many of them had been right about what they said while some had been wrong;2
cv_valid_train_sample_194744-v1_cv_valid_train_sample_194744;cv_valid_train_sample_194744-v1;cv_valid_train_sample_194744;the idea frightened him;the idea frightened him;2
cv_valid_train_sample_194745-v1_cv_valid_train_sample_194745;cv_valid_train_sample_194745-v1;cv_valid_train_sample_194745;there was no justification provided;there was no justification provided;2
cv_valid_train_sample_194746-v1_cv_valid_train_sample_194746;cv_valid_train_sample_194746-v1;cv_valid_train_sample_194746;almost everyone here speaks spanish;almost everyone here speaks spanish;2
cv_valid_train_sample_194747-v1_cv_valid_train_sample_194747;cv_valid_train_sample_194747-v1;cv_valid_train_sample_194747;i myself heard nothing of that;i myself heard nothing of that;2
cv_valid_train_sample_194748-v1_cv_valid_train_sample_194748;cv_valid_train_sample_194748-v1;cv_valid_train_sample_194748;he left without saying goodbye to the crystal merchant;he left without saying goodbye to the crystal merchant;2
cv_valid_train_sample_194749-v1_cv_valid_train_sample_194749;cv_valid_train_sample_194749-v1;cv_valid_train_sample_194749;many telescopes were pointed at it;many telescopes were pointed at it;2
cv_valid_train_sample_194750-v1_cv_valid_train_sample_194750;cv_valid_train_sample_194750-v1;cv_valid_train_sample_194750;the thing itself was almost entirely buried in sand;the thing itself was almost entirely buried in sand;2
cv_valid_train_sample_194751-v1_cv_valid_train_sample_194751;cv_valid_train_sample_194751-v1;cv_valid_train_sample_194751;having a nervous breakdown;having a nervous breakdown;2
cv_valid_train_sample_194752-v1_cv_valid_train_sample_194752;cv_valid_train_sample_194752-v1;cv_valid_train_sample_194752;the tricky part is integrating it with dragonfly;the tricky part is integrating it with dragonfly;2
cv_valid_train_sample_194753-v1_cv_valid_train_sample_194753;cv_valid_train_sample_194753-v1;cv_valid_train_sample_194753;you could save that poor devil's life;you could save that poor devil's life;2
cv_valid_train_sample_194754-v1_cv_valid_train_sample_194754;cv_valid_train_sample_194754-v1;cv_valid_train_sample_194754;i told him that was what i had come here to learn;i told him that was what i had come here to learn;2
cv_valid_train_sample_194755-v1_cv_valid_train_sample_194755;cv_valid_train_sample_194755-v1;cv_valid_train_sample_194755;replace the ts in tim tebow's name with any other consonant to get a star wars character;replace the ts in tim tebow's name with any other consonant to get a star wars character;2
cv_valid_train_sample_194756-v1_cv_valid_train_sample_194756;cv_valid_train_sample_194756-v1;cv_valid_train_sample_194756;it spread through the planet's atmosphere and obscured its more familiar features;it spread through the planet's atmosphere and obscured its more familiar features;2
cv_valid_train_sample_194757-v1_cv_valid_train_sample_194757;cv_valid_train_sample_194757-v1;cv_valid_train_sample_194757;the falcon's beak carries bits of me myself the desert said;the falcon's beak carries bits of me myself the desert said;2
cv_valid_train_sample_194758-v1_cv_valid_train_sample_194758;cv_valid_train_sample_194758-v1;cv_valid_train_sample_194758;their faces were hidden behind blue veils with only their eyes showing;their faces were hidden behind blue veils with only their eyes showing;2
cv_valid_train_sample_194759-v1_cv_valid_train_sample_194759;cv_valid_train_sample_194759-v1;cv_valid_train_sample_194759;no one seemed to have thought about it that night;no one seemed to have thought about it that night;2
cv_valid_train_sample_194760-v1_cv_valid_train_sample_194760;cv_valid_train_sample_194760-v1;cv_valid_train_sample_194760;but now i'm sad and alone;but now i'm sad and alone;2
cv_valid_train_sample_194761-v1_cv_valid_train_sample_194761;cv_valid_train_sample_194761-v1;cv_valid_train_sample_194761;but that was simply because my eye was tired;but that was simply because my eye was tired;2
cv_valid_train_sample_194762-v1_cv_valid_train_sample_194762;cv_valid_train_sample_194762-v1;cv_valid_train_sample_194762;don't let them get away;don't let them get away;2
cv_valid_train_sample_194763-v1_cv_valid_train_sample_194763;cv_valid_train_sample_194763-v1;cv_valid_train_sample_194763;i know you're unhappy;i know you're unhappy;2
cv_valid_train_sample_194764-v1_cv_valid_train_sample_194764;cv_valid_train_sample_194764-v1;cv_valid_train_sample_194764;he was alarmed by what had happened;he was alarmed by what had happened;2
cv_valid_train_sample_194765-v1_cv_valid_train_sample_194765;cv_valid_train_sample_194765-v1;cv_valid_train_sample_194765;because you have already lost your savings twice;because you have already lost your savings twice;2
cv_valid_train_sample_194766-v1_cv_valid_train_sample_194766;cv_valid_train_sample_194766-v1;cv_valid_train_sample_194766;what makes you think they're even interested;what makes you think they're even interested;2
cv_valid_train_sample_194767-v1_cv_valid_train_sample_194767;cv_valid_train_sample_194767-v1;cv_valid_train_sample_194767;she would never know the difference because she didn't know how to read;she would never know the difference because she didn't know how to read;2
cv_valid_train_sample_194768-v1_cv_valid_train_sample_194768;cv_valid_train_sample_194768-v1;cv_valid_train_sample_194768;that's why i'm an angel second class;that's why i'm an angel second class;2
cv_valid_train_sample_194769-v1_cv_valid_train_sample_194769;cv_valid_train_sample_194769-v1;cv_valid_train_sample_194769;and better still to be alone with one's books;and better still to be alone with one's books;2
cv_valid_train_sample_194770-v1_cv_valid_train_sample_194770;cv_valid_train_sample_194770-v1;cv_valid_train_sample_194770;he should respect tradition;he should respect tradition;2
cv_valid_train_sample_194771-v1_cv_valid_train_sample_194771;cv_valid_train_sample_194771-v1;cv_valid_train_sample_194771;i'll do anything you say;i'll do anything you say;2
cv_valid_train_sample_194772-v1_cv_valid_train_sample_194772;cv_valid_train_sample_194772-v1;cv_valid_train_sample_194772;that makes sense the alchemist answered;that makes sense the alchemist answered;2
cv_valid_train_sample_194773-v1_cv_valid_train_sample_194773;cv_valid_train_sample_194773-v1;cv_valid_train_sample_194773;the top had certainly ceased to rotate;the top had certainly ceased to rotate;2
cv_valid_train_sample_194774-v1_cv_valid_train_sample_194774;cv_valid_train_sample_194774-v1;cv_valid_train_sample_194774;he remembered what the old man had said about offering something you didn't even have yet;he remembered what the old man had said about offering something you didn't even have yet;2
cv_valid_train_sample_194775-v1_cv_valid_train_sample_194775;cv_valid_train_sample_194775-v1;cv_valid_train_sample_194775;tell me more about your dream said the woman;tell me more about your dream said the woman;2
cv_valid_train_sample_194776-v1_cv_valid_train_sample_194776;cv_valid_train_sample_194776-v1;cv_valid_train_sample_194776;i have to admit that my horizon has expanded exponentially;i have to admit that my horizon has expanded exponentially;2
cv_valid_train_sample_194777-v1_cv_valid_train_sample_194777;cv_valid_train_sample_194777-v1;cv_valid_train_sample_194777;let's have your story;let's have your story;2
cv_valid_train_sample_194778-v1_cv_valid_train_sample_194778;cv_valid_train_sample_194778-v1;cv_valid_train_sample_194778;no one attacks an oasis;no one attacks an oasis;2
cv_valid_train_sample_194779-v1_cv_valid_train_sample_194779;cv_valid_train_sample_194779-v1;cv_valid_train_sample_194779;i had the everyone has gary busey's teeth dream again;i had the everyone has gary busey's teeth dream again;2
cv_valid_train_sample_194780-v1_cv_valid_train_sample_194780;cv_valid_train_sample_194780-v1;cv_valid_train_sample_194780;am i going to find my treasure he asked;am i going to find my treasure he asked;2
cv_valid_train_sample_194781-v1_cv_valid_train_sample_194781;cv_valid_train_sample_194781-v1;cv_valid_train_sample_194781;what about this job;what about this job;2
cv_valid_train_sample_194782-v1_cv_valid_train_sample_194782;cv_valid_train_sample_194782-v1;cv_valid_train_sample_194782;it seemed to him that it fell to earth about one hundred miles east of here;it seemed to him that it fell to earth about one hundred miles east of here;2
cv_valid_train_sample_194783-v1_cv_valid_train_sample_194783;cv_valid_train_sample_194783-v1;cv_valid_train_sample_194783;the boy awoke as the sun rose;the boy awoke as the sun rose;2
cv_valid_train_sample_194784-v1_cv_valid_train_sample_194784;cv_valid_train_sample_194784-v1;cv_valid_train_sample_194784;absolutely despicable that gingerbread men are forced to live in houses made of their own flesh;absolutely despicable that gingerbread men are forced to live in houses made of their own flesh;2
cv_valid_train_sample_194785-v1_cv_valid_train_sample_194785;cv_valid_train_sample_194785-v1;cv_valid_train_sample_194785;they eat lunch together often but dont really talk outside the office;they eat lunch together often but dont really talk outside the office;2
cv_valid_train_sample_194786-v1_cv_valid_train_sample_194786;cv_valid_train_sample_194786-v1;cv_valid_train_sample_194786;can i get a woot woot;can i get a woot woot;2
cv_valid_train_sample_194787-v1_cv_valid_train_sample_194787;cv_valid_train_sample_194787-v1;cv_valid_train_sample_194787;he had already seen many people come and go and the desert remained as it was;he had already seen many people come and go and the desert remained as it was;2
cv_valid_train_sample_194788-v1_cv_valid_train_sample_194788;cv_valid_train_sample_194788-v1;cv_valid_train_sample_194788;he really was a king;he really was a king;2
cv_valid_train_sample_194789-v1_cv_valid_train_sample_194789;cv_valid_train_sample_194789-v1;cv_valid_train_sample_194789;have you no idea who could have done it;have you no idea who could have done it;2
cv_valid_train_sample_194790-v1_cv_valid_train_sample_194790;cv_valid_train_sample_194790-v1;cv_valid_train_sample_194790;jim became head of the draft board;jim became head of the draft board;2
cv_valid_train_sample_194791-v1_cv_valid_train_sample_194791;cv_valid_train_sample_194791-v1;cv_valid_train_sample_194791;it commenced to blow harder raising the desert sands;it commenced to blow harder raising the desert sands;2
cv_valid_train_sample_194792-v1_cv_valid_train_sample_194792;cv_valid_train_sample_194792-v1;cv_valid_train_sample_194792;a practice of infidels he said to himself;a practice of infidels he said to himself;2
cv_valid_train_sample_194793-v1_cv_valid_train_sample_194793;cv_valid_train_sample_194793-v1;cv_valid_train_sample_194793;no matter what happens it's a nice vote of confidence you're getting from your boss;no matter what happens it's a nice vote of confidence you're getting from your boss;2
cv_valid_train_sample_194794-v1_cv_valid_train_sample_194794;cv_valid_train_sample_194794-v1;cv_valid_train_sample_194794;in another year maybe i can help;in another year maybe i can help;2
cv_valid_train_sample_194795-v1_cv_valid_train_sample_194795;cv_valid_train_sample_194795-v1;cv_valid_train_sample_194795;he wandered for a while keeping the date palms of the oasis within sight;he wandered for a while keeping the date palms of the oasis within sight;2
cv_valid_train_sample_194796-v1_cv_valid_train_sample_194796;cv_valid_train_sample_194796-v1;cv_valid_train_sample_194796;henderson went into the railway station to telegraph the news to london;henderson went into the railway station to telegraph the news to london;2
cv_valid_train_sample_194797-v1_cv_valid_train_sample_194797;cv_valid_train_sample_194797-v1;cv_valid_train_sample_194797;i think it's about bird hunting but now i can see how that might be misinterpreted;i think it's about bird hunting but now i can see how that might be misinterpreted;2
cv_valid_train_sample_194798-v1_cv_valid_train_sample_194798;cv_valid_train_sample_194798-v1;cv_valid_train_sample_194798;he was immensely excited at the news;he was immensely excited at the news;2
cv_valid_train_sample_194799-v1_cv_valid_train_sample_194799;cv_valid_train_sample_194799-v1;cv_valid_train_sample_194799;the boy swore that every time he heard the alarm he would heed its message;the boy swore that every time he heard the alarm he would heed its message;2
cv_valid_train_sample_194800-v1_cv_valid_train_sample_194800;cv_valid_train_sample_194800-v1;cv_valid_train_sample_194800;everyone on earth has a treasure that awaits him his heart said;everyone on earth has a treasure that awaits him his heart said;2
cv_valid_train_sample_194801-v1_cv_valid_train_sample_194801;cv_valid_train_sample_194801-v1;cv_valid_train_sample_194801;you left out number five;you left out number five;2
cv_valid_train_sample_194802-v1_cv_valid_train_sample_194802;cv_valid_train_sample_194802-v1;cv_valid_train_sample_194802;it was faintly marked with transverse stripes and slightly flattened from the perfect round;it was faintly marked with transverse stripes and slightly flattened from the perfect round;2
cv_valid_train_sample_194803-v1_cv_valid_train_sample_194803;cv_valid_train_sample_194803-v1;cv_valid_train_sample_194803;ill join you in a minute after i lock my bike;ill join you in a minute after i lock my bike;2
cv_valid_train_sample_194804-v1_cv_valid_train_sample_194804;cv_valid_train_sample_194804-v1;cv_valid_train_sample_194804;walking along in the silence he had no regrets;walking along in the silence he had no regrets;2
cv_valid_train_sample_194805-v1_cv_valid_train_sample_194805;cv_valid_train_sample_194805-v1;cv_valid_train_sample_194805;from here on you will be alone the alchemist said;from here on you will be alone the alchemist said;2
cv_valid_train_sample_194806-v1_cv_valid_train_sample_194806;cv_valid_train_sample_194806-v1;cv_valid_train_sample_194806;at that point the omens will tell you that your treasure is buried forever;at that point the omens will tell you that your treasure is buried forever;2
cv_valid_train_sample_194807-v1_cv_valid_train_sample_194807;cv_valid_train_sample_194807-v1;cv_valid_train_sample_194807;you didn't have to do any cleaning he said;you didn't have to do any cleaning he said;2
cv_valid_train_sample_194808-v1_cv_valid_train_sample_194808;cv_valid_train_sample_194808-v1;cv_valid_train_sample_194808;the morning post just turned shelly eric over to the sheriff;the morning post just turned shelly eric over to the sheriff;2
cv_valid_train_sample_194809-v1_cv_valid_train_sample_194809;cv_valid_train_sample_194809-v1;cv_valid_train_sample_194809;i needed immediate access;i needed immediate access;2
cv_valid_train_sample_194810-v1_cv_valid_train_sample_194810;cv_valid_train_sample_194810-v1;cv_valid_train_sample_194810;how much do you want;how much do you want;2
cv_valid_train_sample_194811-v1_cv_valid_train_sample_194811;cv_valid_train_sample_194811-v1;cv_valid_train_sample_194811;and a labor leader like melville;and a labor leader like melville;2
cv_valid_train_sample_194812-v1_cv_valid_train_sample_194812;cv_valid_train_sample_194812-v1;cv_valid_train_sample_194812;all the villagers cheered;all the villagers cheered;2
cv_valid_train_sample_194813-v1_cv_valid_train_sample_194813;cv_valid_train_sample_194813-v1;cv_valid_train_sample_194813;it left a greenish streak that glowed for some seconds;it left a greenish streak that glowed for some seconds;2
cv_valid_train_sample_194814-v1_cv_valid_train_sample_194814;cv_valid_train_sample_194814-v1;cv_valid_train_sample_194814;it looked like a rusty gas float;it looked like a rusty gas float;2
cv_valid_train_sample_194815-v1_cv_valid_train_sample_194815;cv_valid_train_sample_194815-v1;cv_valid_train_sample_194815;i was just thinking of a flaming rum punch;i was just thinking of a flaming rum punch;2
cv_valid_train_sample_194816-v1_cv_valid_train_sample_194816;cv_valid_train_sample_194816-v1;cv_valid_train_sample_194816;weather in holly recreation area at eight pm;weather in holly recreation area at eight pm;2
cv_valid_train_sample_194817-v1_cv_valid_train_sample_194817;cv_valid_train_sample_194817-v1;cv_valid_train_sample_194817;the loafers and golf caddies were used to hanging out near the railway station;the loafers and golf caddies were used to hanging out near the railway station;2
cv_valid_train_sample_194818-v1_cv_valid_train_sample_194818;cv_valid_train_sample_194818-v1;cv_valid_train_sample_194818;but there was a sixth day the sun went on;but there was a sixth day the sun went on;2
cv_valid_train_sample_194819-v1_cv_valid_train_sample_194819;cv_valid_train_sample_194819-v1;cv_valid_train_sample_194819;i should have repeated it for him;i should have repeated it for him;2
cv_valid_train_sample_194820-v1_cv_valid_train_sample_194820;cv_valid_train_sample_194820-v1;cv_valid_train_sample_194820;i'd like to live in it;i'd like to live in it;2
cv_valid_train_sample_194821-v1_cv_valid_train_sample_194821;cv_valid_train_sample_194821-v1;cv_valid_train_sample_194821;three days from now he would be with the merchant's daughter;three days from now he would be with the merchant's daughter;2
cv_valid_train_sample_194822-v1_cv_valid_train_sample_194822;cv_valid_train_sample_194822-v1;cv_valid_train_sample_194822;some men were smoking from a gigantic pipe that they passed from one to the other;some men were smoking from a gigantic pipe that they passed from one to the other;2
cv_valid_train_sample_194823-v1_cv_valid_train_sample_194823;cv_valid_train_sample_194823-v1;cv_valid_train_sample_194823;this is mr zach carter;this is mr zach carter;2
cv_valid_train_sample_194824-v1_cv_valid_train_sample_194824;cv_valid_train_sample_194824-v1;cv_valid_train_sample_194824;sunburns can be avoided by applying sunscreen or by staying in the shadows;sunburns can be avoided by applying sunscreen or by staying in the shadows;2
cv_valid_train_sample_194825-v1_cv_valid_train_sample_194825;cv_valid_train_sample_194825-v1;cv_valid_train_sample_194825;few people realise the immensity of vacancy;few people realise the immensity of vacancy;2
cv_valid_train_sample_194826-v1_cv_valid_train_sample_194826;cv_valid_train_sample_194826-v1;cv_valid_train_sample_194826;this man looked exactly the same except that now the roles were reversed;this man looked exactly the same except that now the roles were reversed;2
cv_valid_train_sample_194827-v1_cv_valid_train_sample_194827;cv_valid_train_sample_194827-v1;cv_valid_train_sample_194827;they spoke about mercury salt dragons and kings and he didn't understand any of it;they spoke about mercury salt dragons and kings and he didn't understand any of it;2
cv_valid_train_sample_194828-v1_cv_valid_train_sample_194828;cv_valid_train_sample_194828-v1;cv_valid_train_sample_194828;it's going to take a while the boy said;it's going to take a while the boy said;2
cv_valid_train_sample_194829-v1_cv_valid_train_sample_194829;cv_valid_train_sample_194829-v1;cv_valid_train_sample_194829;i often wish you weren't such a stinker;i often wish you weren't such a stinker;2
cv_valid_train_sample_194830-v1_cv_valid_train_sample_194830;cv_valid_train_sample_194830-v1;cv_valid_train_sample_194830;almost everyone here speaks spanish;almost everyone here speaks spanish;2
cv_valid_train_sample_194831-v1_cv_valid_train_sample_194831;cv_valid_train_sample_194831-v1;cv_valid_train_sample_194831;it was seen early in the morning rushing over eastward;it was seen early in the morning rushing over eastward;2
cv_valid_train_sample_194832-v1_cv_valid_train_sample_194832;cv_valid_train_sample_194832-v1;cv_valid_train_sample_194832;i thought the unscrewing might be automatic;i thought the unscrewing might be automatic;2
cv_valid_train_sample_194833-v1_cv_valid_train_sample_194833;cv_valid_train_sample_194833-v1;cv_valid_train_sample_194833;how can you tell;how can you tell;2
cv_valid_train_sample_194834-v1_cv_valid_train_sample_194834;cv_valid_train_sample_194834-v1;cv_valid_train_sample_194834;we don't know what's in the confounded thing do you;we don't know what's in the confounded thing do you;2
cv_valid_train_sample_194835-v1_cv_valid_train_sample_194835;cv_valid_train_sample_194835-v1;cv_valid_train_sample_194835;we lit the lantern and walked over to his house;we lit the lantern and walked over to his house;2
cv_valid_train_sample_194836-v1_cv_valid_train_sample_194836;cv_valid_train_sample_194836-v1;cv_valid_train_sample_194836;it's not easy to find the philosopher's stone said the englishman;it's not easy to find the philosopher's stone said the englishman;2
cv_valid_train_sample_194837-v1_cv_valid_train_sample_194837;cv_valid_train_sample_194837-v1;cv_valid_train_sample_194837;maybe it was yesterday;maybe it was yesterday;2
cv_valid_train_sample_194838-v1_cv_valid_train_sample_194838;cv_valid_train_sample_194838-v1;cv_valid_train_sample_194838;relaxed and unhurried he resolved that he would walk through the narrow streets of tangier;relaxed and unhurried he resolved that he would walk through the narrow streets of tangier;2
cv_valid_train_sample_194839-v1_cv_valid_train_sample_194839;cv_valid_train_sample_194839-v1;cv_valid_train_sample_194839;he needs three days answered the alchemist;he needs three days answered the alchemist;2
cv_valid_train_sample_194840-v1_cv_valid_train_sample_194840;cv_valid_train_sample_194840-v1;cv_valid_train_sample_194840;don't tell me you were worried;don't tell me you were worried;2
cv_valid_train_sample_194841-v1_cv_valid_train_sample_194841;cv_valid_train_sample_194841-v1;cv_valid_train_sample_194841;it's like the camel driver said 'eat when it's time to eat;it's like the camel driver said eat when it's time to eat;2
cv_valid_train_sample_194842-v1_cv_valid_train_sample_194842;cv_valid_train_sample_194842-v1;cv_valid_train_sample_194842;the boy put the stones in his pouch;the boy put the stones in his pouch;2
cv_valid_train_sample_194843-v1_cv_valid_train_sample_194843;cv_valid_train_sample_194843-v1;cv_valid_train_sample_194843;what time is it;what time is it;2
cv_valid_train_sample_194844-v1_cv_valid_train_sample_194844;cv_valid_train_sample_194844-v1;cv_valid_train_sample_194844;i'll return just as your father came back to your mother he said;i'll return just as your father came back to your mother he said;2
cv_valid_train_sample_194845-v1_cv_valid_train_sample_194845;cv_valid_train_sample_194845-v1;cv_valid_train_sample_194845;it was however still so hot from its flight through the air;it was however still so hot from its flight through the air;2
cv_valid_train_sample_194846-v1_cv_valid_train_sample_194846;cv_valid_train_sample_194846-v1;cv_valid_train_sample_194846;for that price you might as well get the brand name cordless drill;for that price you might as well get the brand name cordless drill;2
cv_valid_train_sample_194847-v1_cv_valid_train_sample_194847;cv_valid_train_sample_194847-v1;cv_valid_train_sample_194847;but he's on the right track;but he's on the right track;2
cv_valid_train_sample_194848-v1_cv_valid_train_sample_194848;cv_valid_train_sample_194848-v1;cv_valid_train_sample_194848;i understand sheep they're no longer a problem and they can be good friends;i understand sheep they're no longer a problem and they can be good friends;2
cv_valid_train_sample_194849-v1_cv_valid_train_sample_194849;cv_valid_train_sample_194849-v1;cv_valid_train_sample_194849;it spread through the planet's atmosphere and obscured its more familiar features;it spread through the planet's atmosphere and obscured its more familiar features;2
cv_valid_train_sample_194850-v1_cv_valid_train_sample_194850;cv_valid_train_sample_194850-v1;cv_valid_train_sample_194850;what the devil do you want;what the devil do you want;2
cv_valid_train_sample_194851-v1_cv_valid_train_sample_194851;cv_valid_train_sample_194851-v1;cv_valid_train_sample_194851;i can see that right now;i can see that right now;2
cv_valid_train_sample_194852-v1_cv_valid_train_sample_194852;cv_valid_train_sample_194852-v1;cv_valid_train_sample_194852;do you want to go to work for me the merchant asked;do you want to go to work for me the merchant asked;2
